{
  "$schema": "http://json-schema.org/draft-07/schema#",
  "title": "SOTONSHIP verification proof inputs",
  "description": "Explicit input mapping and finite proof bounds accepted by the backend ProofInputsDto. Use this object directly, without a proofInputs wrapper.",
  "type": "object",
  "additionalProperties": false,
  "required": [
    "cobolDialectProfile",
    "cobolSourceFormat",
    "amountField",
    "rateField",
    "resultField",
    "javaAmountParameter",
    "javaRateParameter",
    "amountMinCents",
    "amountMaxCents",
    "referenceCurrencyPair",
    "referenceSource",
    "referenceCollectedDate"
  ],
  "properties": {
    "cobolDialectProfile": {
      "type": "string",
      "enum": [
        "IBM_ENTERPRISE_COBOL_ZOS_6_5_SCALAR_SUBSET_V1"
      ],
      "description": "The engine’s explicitly supported IBM Enterprise COBOL scalar subset; not a complete compiler profile."
    },
    "cobolSourceFormat": {
      "type": "string",
      "enum": [
        "FREE",
        "FIXED"
      ],
      "description": "Use FREE for the included example. FIXED accepts the engine’s restricted reference format."
    },
    "amountField": {
      "type": "string",
      "minLength": 1,
      "maxLength": 64,
      "description": "Exact COBOL input amount field name."
    },
    "rateField": {
      "type": "string",
      "minLength": 1,
      "maxLength": 64,
      "description": "Exact COBOL reference-rate field name."
    },
    "resultField": {
      "type": "string",
      "minLength": 1,
      "maxLength": 64,
      "description": "Exact COBOL output field name."
    },
    "javaAmountParameter": {
      "type": "string",
      "minLength": 1,
      "maxLength": 64,
      "description": "Exact Java method parameter corresponding to the COBOL input amount."
    },
    "javaRateParameter": {
      "type": "string",
      "minLength": 1,
      "maxLength": 64,
      "description": "Exact Java method parameter corresponding to the COBOL reference rate."
    },
    "amountMinCents": {
      "type": "integer",
      "minimum": -999999999,
      "maximum": 999999999,
      "description": "Inclusive lower input bound in integer cents; must not exceed amountMaxCents."
    },
    "amountMaxCents": {
      "type": "integer",
      "minimum": -999999999,
      "maximum": 999999999,
      "description": "Inclusive upper input bound in integer cents."
    },
    "referenceCurrencyPair": {
      "type": "string",
      "pattern": "^[A-Z]{3}/[A-Z]{3}$",
      "description": "Exact currency pair identifying a reference-rate record in the backend.",
      "examples": [
        "GBP/EUR"
      ]
    },
    "referenceSource": {
      "type": "string",
      "minLength": 1,
      "maxLength": 300,
      "description": "Exact source name of the backend’s reference-rate record.",
      "examples": [
        "Bank of England Daily Spot Rate"
      ]
    },
    "referenceCollectedDate": {
      "type": "string",
      "pattern": "^\\d{4}-\\d{2}-\\d{2}$",
      "description": "Exact collection date of the reference-rate record, distinct from the observation date.",
      "examples": [
        "2026-10-17"
      ]
    }
  }
}
